title,company,location,tags,date_posted,source
Full Stack Software Engineer,Daisychain,,"engineer, dev, javascript, ruby, postgres, vue, typescript, redis, aws",2025-05-14T15:01:34+00:00,RemoteOK
Testing Engineer,Trial Library,"San Francisco, CA","testing, system, frontend, security, python, software, test, code, qa, typescript, api, reliability, health, healthcare, engineer, engineering, backend",2025-05-14T00:00:07+00:00,RemoteOK
Accountant,Find,Sliema,"accountant, support, controller, accounting, financial, finance, microsoft, management, operations, non tech",2025-05-13T16:00:31+00:00,RemoteOK
Commercial Content Editor,Find,,"crypto, cryptocurrency, financial, seo, management, content, operations, sales, non tech",2025-05-13T16:00:25+00:00,RemoteOK
Salesforce Engineer,Oowlish Technology,,"salesforce, software, growth, engineer",2025-05-13T08:00:16+00:00,RemoteOK
Account Coordinator,Bluelight Consulting,"Indianapolis, Indiana","consulting, training, coordinator, support, growth, manager, education, management, content, senior, marketing",2025-05-13T08:00:10+00:00,RemoteOK
Head of Growth,AVA Foundation,Anywhere,"growth, design, web3, crypto, test, travel, strategy, management, lead, digital nomad",2025-05-13T06:00:04+00:00,RemoteOK
Werkstudent im Bereich SAP &amp; Cloud Automation,Public Cloud Group,Alle,"python, cloud, linux",2025-05-12T16:00:04+00:00,RemoteOK
Senior Golang Engineer,WunderGraph,,"golang, graphql, senior, golang, engineer",2025-05-12T10:15:02+00:00,RemoteOK
Software Engineering Team Lead,bloXroute Labs,Remote,"software, support, testing, growth, code, lead, go, engineering, backend",2025-05-12T09:00:02+00:00,RemoteOK
Salesforce Lead,Bounteous,India,"salesforce, design, security, consultancy, technical, software, management, lead, analytics, legal, digital nomad",2025-05-11T16:00:19+00:00,RemoteOK
Mid Market Sales Account Executive,FiscalNote,United States - Remote,"salesforce, training, support, software, leader, management, lead, sales, recruiting, executive",2025-05-11T16:00:12+00:00,RemoteOK
Support Specialist,Vesta,Remote,"system, security, support, software, financial, finance, cloud, engineering",2025-05-11T14:00:03+00:00,RemoteOK
Senior Data Analytics Engineer,Fullscript,,"design, python, technical, support, testing, growth, code, devops, financial, cloud, leader, senior, junior, analytics, health, healthcare, engineer, engineering, digital nomad",2025-05-10T21:00:03+00:00,RemoteOK
Digital Editorial Manager,Cozymeal,,"manager, support, seo, lead, content",2025-05-10T13:00:08+00:00,RemoteOK
Senior Fullstack Software Engineer,Blotato,,"dev, javascript, typescript, heroku, aws",2025-05-10T01:38:55+00:00,RemoteOK
Investment Manager,Wintermute,USA / Remote,"manager, web3, defi, crypto, cryptocurrency, technical, support, software, growth, financial, investment, finance, admin, management",2025-05-09T21:00:06+00:00,RemoteOK
Content Writer,Blink UX,All Locations,"design, consulting, technical, recruiter, writer, growth, ux, voice, seo, ads, content, marketing, analytics, sales, digital nomad",2025-05-09T11:00:11+00:00,RemoteOK
Sales Development Representative,Torch,Remote,"support, lead, marketing, sales",2025-05-09T11:00:02+00:00,RemoteOK
Sr Software Engineer Cross Platform Applications,Smallstep,,"golang, software, engineer",2025-05-08T17:15:03+00:00,RemoteOK
Sr Software Engineer Backend Web Applications,Smallstep,,"golang, software, web, engineer, backend",2025-05-08T17:15:03+00:00,RemoteOK
Web3 Marketing Manager,"Manta Network, Powered by p0x labs",Anywhere,"web3, manager, voice, content, marketer, marketing, full-time, non tech",2025-05-08T17:00:02+00:00,RemoteOK
Web3 Marketing Manager,"Manta Network, Powered by p0x labs",Anywhere,"web3, manager, content, marketer, marketing, full-time, non tech",2025-05-08T11:00:01+00:00,RemoteOK
Smart Contract Engineer,Risk Labs,Remote,"design, defi, crypto, training, game, technical, support, software, code, junior, engineer, engineering, digital nomad",2025-05-08T09:00:03+00:00,RemoteOK
Australia Deputy MLRO,MoonPay,Australia - Remote,"web3, crypto, training, recruiter, support, software, growth, voice, financial, video, finance, management, senior, analytics",2025-05-07T16:00:08+00:00,RemoteOK
Account Executive,Creator Deck,Remote,"content, health, executive",2025-05-07T15:00:09+00:00,RemoteOK
Design Centric Senior Front End Engineer,Dapper Labs,"US / Canada, Remote","design, front-end, frontend, software, code, javascript, css, senior, engineer, digital nomad",2025-05-07T14:00:04+00:00,RemoteOK
Senior Software Engineer Hosted Team,Cast AI,,"golang, software, senior, engineer",2025-05-07T09:15:04+00:00,RemoteOK
Sr Software Engineer,Smallstep,,"golang, software, engineer",2025-05-07T08:15:02+00:00,RemoteOK
Senior Front End Engineer,Maxflow BV / CrazyGames,,"design, react, front-end, frontend, designer, code, manager, typescript, senior, analytics, engineer, engineering, digital nomad",2025-05-07T08:01:50+00:00,RemoteOK
Technical Documentation Engineer,Tether Operations Limited,,"bitcoin, technical, writer, support, growth, code, financial, fintech, git, node.js, leader, ops, engineer",2025-05-07T08:01:42+00:00,RemoteOK
Dutch Content Creator,TransPerfect,,content,2025-05-07T08:01:32+00:00,RemoteOK
Product Marketing Manager Europe,Hostaway,,"manager, saas, testing, growth, education, strategy, marketing, sales, health",2025-05-07T08:01:24+00:00,RemoteOK
Account Executive,Actindo AG,,"saas, software, sales, backend, executive",2025-05-07T08:00:55+00:00,RemoteOK
Software Engineer III,Nextech,Remote,"software, full-stack, technical, support, code, travel, scrum, accounting, devops, javascript, finance, microsoft, leader, healthcare, engineer",2025-05-07T08:00:39+00:00,RemoteOK
Data and Business Intelligence Engineer Mid Level Fully,Utility Profit + Sunroom,,"design, saas, leader, operations, telecom, engineer, educational, digital nomad",2025-05-07T08:00:15+00:00,RemoteOK
Senior Software Engineer,Nava,Remote,"software, design, security, python, training, consultancy, technical, support, growth, code, web, travel, devops, java, cloud, mobile, senior, health, recruiting, engineer, engineering, backend, digital nomad",2025-05-07T08:00:03+00:00,RemoteOK
Learning Cohort Moderator,Generation,,"design, system, teach, support, travel, adult, financial, management, content, analytics, part-time, digital nomad",2025-05-07T06:00:05+00:00,RemoteOK
Category Manager Walmart,e.l.f. Beauty,United States - Remote,"manager, growth, microsoft, excel, analytics, sales, full-time",2025-05-07T00:00:07+00:00,RemoteOK
Mobile App Developer,CrazyGames,,"dev, mobile, iOS, android, web dev, javascript, react",2025-05-06T13:21:31+00:00,RemoteOK
Product Partnerships Manager,Presto,APAC,"manager, design, crypto, cryptocurrency, growth, fintech, management, digital nomad",2025-05-06T13:00:03+00:00,RemoteOK
Member of Technical Staff Transparency Front End Engineer,Anchorage Digital,United States,"crypto, frontend, security, technical, support, software, testing, test, growth, code, web, javascript, financial, finance, bank, marketing, legal, engineer, engineering",2025-05-06T10:00:04+00:00,RemoteOK
Head of Marketing,The People Brand,United States,"amazon, ceo, technical, test, growth, strategy, management, lead, content, marketing, sales",2025-05-06T00:00:50+00:00,RemoteOK
Backend Software Engineer,Firework,Canada,"software, design, saas, graphql, system, python, technical, code, video, engineer, engineering, backend, digital nomad",2025-05-06T00:00:22+00:00,RemoteOK
Sales Development Representative,Firework,MÃ©xico,"saas, salesforce, support, growth, video, lead, content, operations, sales",2025-05-06T00:00:08+00:00,RemoteOK
QA Engineer,Contra,,engineer,2025-05-05T22:27:36+00:00,RemoteOK
Social Media Editor,Contra,,"marketing, other, social media",2025-05-05T22:25:27+00:00,RemoteOK
Influencer Marketing Intern,NextStep,,"marketing, internship, social media, remote, influencer-marketing, digital marketing, entry level, campaign-management",2025-05-04T11:19:35+00:00,RemoteOK
Principal Product Designer,15Five,"US, Remote","design, hr, training, designer, test, ux, manager, education, management, health, full-time, digital nomad",2025-05-04T09:00:06+00:00,RemoteOK
Operations Intern,CoinGecko,Malaysia,"web3, nft, cryptocurrency, cryptocurrencies, support, web, financial, education, leader, operations, analytics, internship, non tech",2025-05-04T06:00:04+00:00,RemoteOK
Software Engineer Android,Ontic,"Noida, India","software, design, developer, testing, ui, code, education, cloud, git, android, engineer, digital nomad",2025-05-03T14:00:05+00:00,RemoteOK
Computational Journalist Data Reporting,500 WP Company LLC,DC-Washington-TWP Headquarters,"embedded, training, software, director, devops, education, cloud, leader, health, engineering, full-time, part-time",2025-05-03T00:00:03+00:00,RemoteOK
Fullstack Software Engineer,BlackCloak,United States,"software, design, system, front-end, back-end, architect, technical, code, web, devops, javascript, css, nosql, api, mobile, lead, junior, health, engineer, fullstack, full-time, digital nomad",2025-05-02T18:00:07+00:00,RemoteOK
Salesforce Developer,StackAdapt,Canada,"salesforce, developer, design, saas, system, security, training, technical, support, software, scrum, devops, cloud, css, ads, api, administrator, leader, management, lead, operations, operational, marketing, sales, health, digital nomad",2025-05-02T16:00:10+00:00,RemoteOK
Senior Technical Product Manager Wallets,Tether Operations Limited,,"manager, defi, crypto, bitcoin, technical, testing, growth, javascript, financial, fintech, leader, management, lead, senior, ops",2025-05-02T15:00:04+00:00,RemoteOK
Copywriter,MissionWired,United States - Remote Flexibility,"copywriter, support, voice, lead, marketing, health, non tech",2025-05-02T14:00:06+00:00,RemoteOK
Lead Backend Engineer Debugger,Tenderly,Europe OR In-Office Belgrade,"design, web3, ethereum, system, full-stack, technical, support, growth, code, cloud, node, management, lead, reliability, engineer, engineering, backend, digital nomad",2025-05-02T10:00:03+00:00,RemoteOK
Commerce Editor Temporary,BDG,"New York, NY","amazon, wordpress, strategy, content, marketing, analytics, sales, health, e-commerce, non tech",2025-05-01T21:00:01+00:00,RemoteOK
Senior Software Engineer,Contra,,"dev, engineer, full stack",2025-05-01T18:05:55+00:00,RemoteOK
Licensed Professional Clinical Counselor California,Headlight,"Remote, California","training, consult, support, software, growth, lead, marketing, health, executive",2025-05-01T16:00:15+00:00,RemoteOK
Customer Success Manager,Revinate,Australia,"manager, saas, hr, security, consult, technical, support, growth, education, management, lead, marketing, sales",2025-05-01T00:00:07+00:00,RemoteOK
Product Manager VIP,Gate.io,APAC,manager,2025-04-30T10:00:04+00:00,RemoteOK
Content Creator,Contra,,"other, social media",2025-04-29T16:57:17+00:00,RemoteOK
Social Media Video Editor,Contra,,"video, social media, other",2025-04-29T16:55:28+00:00,RemoteOK
Itinerary Creator Turn Your Travels Into ome,Worldee,,"other, travel, writing, marketing",2025-04-29T14:44:28+00:00,RemoteOK
Freight Broker,Givens Transportation Solutions,,"sales, transportation",2025-04-29T13:47:19+00:00,RemoteOK
Research Scientist Statistical Genetics,Deep Genomics,North America,"software, testing, growth, code, cloud, biology",2025-04-29T11:00:01+00:00,RemoteOK
QA Automation Engineer,Kodify Media Group,,quality assurance,2025-04-29T10:36:20+00:00,RemoteOK
Member of Product Atlas Settlement,Anchorage Digital,United States,"design, crypto, cryptocurrency, security, technical, manager, financial, finance, fintech, banking, bank, strategy, management, operational, legal, engineering, digital nomad",2025-04-29T10:00:04+00:00,RemoteOK
Senior Software Engineer Full Stack,Cyngn,"Menlo Park, CA","software, design, saas, system, frontend, docker, code, voice, java, cloud, nosql, typescript, api, management, senior, operational, go, health, engineer, backend, full-time, digital nomad",2025-04-28T18:00:03+00:00,RemoteOK
Sales Operations,Anchorage Digital,United States,"design, crypto, salesforce, security, technical, support, growth, accounting, financial, investment, investor, finance, bank, strategy, management, lead, senior, operations, operational, marketing, analytics, legal, sales, digital nomad",2025-04-28T10:00:03+00:00,RemoteOK
Product Engineer Frontend,Quash,,"frontend, design, react, system, front-end, architect, technical, support, testing, test, qa, typescript, strategy, engineer, backend, digital nomad",2025-04-28T03:00:16+00:00,RemoteOK
Head of Operations Japan,Xsolla,Tokyo,"game, gaming, support, software, growth, management, operations, operational",2025-04-27T00:00:10+00:00,RemoteOK
Data Analyst,KPA,Remote,"analyst, saas, salesforce, training, consulting, technical, support, software, content, operations, excel, health",2025-04-26T16:00:02+00:00,RemoteOK
React + Node Developer Web Applications,Oowlish Technology,,"react, developer, web, frontend, security, full-stack, docker, software, growth, code, node, management, engineering, backend, fullstack, digital nomad",2025-04-26T00:00:05+00:00,RemoteOK
Photo Editor,PlayOn,"Alpharetta, GA","teach, students, support, travel, video, leader, management, content, excel, health, full-time, part-time, non tech",2025-04-25T22:00:02+00:00,RemoteOK
DevOps Engineer Staking,Crypto.com,,"cryptocurrency, system, security, support, devops, cloud, engineer, recruitment, linux",2025-04-25T13:00:01+00:00,RemoteOK
Business Operations Administrator,Anagram,Anywhere,"support, accounting, payroll, finance, administrator, management, operations, operational, recruiting, non tech",2025-04-25T12:00:04+00:00,RemoteOK
Project Coordinator,Lead Bank,Remote,"design, embedded, training, technical, coordinator, support, manager, financial, fintech, banking, finance, bank, management, exec, lead, content, senior, operations, operational, legal, digital nomad",2025-04-24T19:00:12+00:00,RemoteOK
Associate Program Manager,Lead Bank,Remote,"manager, design, embedded, training, technical, support, financial, fintech, banking, finance, bank, management, exec, lead, content, senior, operations, operational, legal, digital nomad",2025-04-24T19:00:02+00:00,RemoteOK
Venture Capital Social Media Manager,VC Lab,Palo Alto,"manager, growth, director, voice, investment, leader, strategy, management, content, analytics, educational",2025-04-24T10:00:03+00:00,RemoteOK
Manager Maintenance,Commonwealth Fusion Systems,"Devens, MA","manager, design, system, technical, growth, travel, assembly, scheme, leader, management, lead, excel, engineering, executive, full-time, digital nomad",2025-04-24T08:01:19+00:00,RemoteOK
Implementation Specialist,SpryPoint,USA,"support, software, testing, growth, travel, manager, financial, investment, management, senior, operations, analytics, sales, go",2025-04-24T08:00:31+00:00,RemoteOK
Senior Full Stack Developer,Zammad,,"dev, full stack, full time",2025-04-24T07:52:28+00:00,RemoteOK
Senior Software Engineer KSPM,Cast AI,,"golang, software, security, senior, engineer",2025-04-23T18:15:05+00:00,RemoteOK
Software Engineer III,Jack Henry,,"golang, software, engineer",2025-04-23T18:15:04+00:00,RemoteOK
Software Engineer Infrastructure,Gauntlet,New York City / San Francisco / Los Angeles / Remote,"software, design, defi, crypto, system, technical, support, code, financial, finance, cloud, operations, reliability, engineer, digital nomad",2025-04-23T14:00:28+00:00,RemoteOK
Software Engineer Data,Gauntlet,New York City / San Francisco / Los Angeles / Remote,"software, design, defi, crypto, system, python, technical, support, code, financial, operations, analytics, reliability, engineer, backend, digital nomad",2025-04-23T10:00:17+00:00,RemoteOK
Software Engineer III Frontend,Shippo,United States,"frontend, software, design, technical, test, growth, code, web, qa, financial, api, lead, marketing, recruiting, engineer, engineering, e-commerce, digital nomad",2025-04-23T08:01:41+00:00,RemoteOK
HQ Senior Frontend Engineer,Job&amp;Talent,"Madrid HQ, ES","frontend, design, amazon, react, redis, system, technical, software, testing, web, voice, javascript, cloud, git, ruby, rails, api, senior, engineer, digital nomad",2025-04-23T08:01:34+00:00,RemoteOK
Software Engineer Microservices,Kong,Toronto,"software, saas, system, technical, developer, code, web, cloud, git, typescript, api, leader, management, sales, healthcare, engineer, engineering, digital nomad",2025-04-23T08:01:13+00:00,RemoteOK
Product Manager,Nextech,Remote,"manager, jira, technical, support, software, travel, accounting, finance, leader, lead, operational, marketing, healthcare, educational",2025-04-23T08:00:49+00:00,RemoteOK
Brand Designer,Contra,,"other, data, consulting, design",2025-04-22T19:49:20+00:00,RemoteOK
Motion Designer,Contra,,"other, data, consulting, design",2025-04-22T19:43:05+00:00,RemoteOK
Data Engineer,Aquent Talent,New York City Metropolitan Area,,2025-05-15T20:59:58,LinkedIn (RapidAPI)
Data Engineer,Aorzon Technologies Inc,New York,,2025-05-15T20:23:26,LinkedIn (RapidAPI)
"Data Engineer (Onsite, US)","AVT, a Wipro company",Fremont,,2025-05-15T20:13:45,LinkedIn (RapidAPI)
"Data Engineer (Onsite, US)","AVT, a Wipro company",Austin,,2025-05-15T20:13:45,LinkedIn (RapidAPI)
Mechanical Sales Engineer - Data Center Cooling (mission-critical manufacturing exp. req.),#twiceasnice Recruiting,Texas,,2025-05-15T20:11:24,LinkedIn (RapidAPI)
Senior Data Engineer,InfoVision Inc.,Irving,,2025-05-15T20:04:57,LinkedIn (RapidAPI)
Senior Fabric Data Engineer,INSPYR Solutions,Miami,,2025-05-15T19:58:04,LinkedIn (RapidAPI)
"Intern, Automation Data Engineer",Cell Signaling Technology (CST),Danvers,,2025-05-15T19:53:04,LinkedIn (RapidAPI)
Principal Data Engineer - AI Systems Performance Engineering,Visa,Austin,,2025-05-15T19:47:15,LinkedIn (RapidAPI)
Data Center Structured Cabling-Project Engineer I | Mortenson,Mortenson,Rayville,,2025-05-15T19:44:41,LinkedIn (RapidAPI)
Data Engineer,Robert Half,New York,,2025-05-15T19:44:37,LinkedIn (RapidAPI)
Data Infrastructure Engineer,Robert Half,New York,,2025-05-15T19:44:36,LinkedIn (RapidAPI)
Data Engineer,Robert Half,Washington,,2025-05-15T19:44:36,LinkedIn (RapidAPI)
Senior Data Engineer,viaPhoton,New York,,2025-05-15T19:42:59,LinkedIn (RapidAPI)
Data Engineer - Hadoop,Matlen Silver,Charlotte,,2025-05-15T19:39:35,LinkedIn (RapidAPI)
Senior Data Engineer,Aura Intelligence,New York,,2025-05-15T19:23:09,LinkedIn (RapidAPI)
Senior Data Engineer,JS Consulting,Jersey City,,2025-05-15T19:19:04,LinkedIn (RapidAPI)
"Data Engineer (HybridMust commute to Sleepy Eye, MN)",Christensen Farms,Sleepy Eye,,2025-05-15T19:16:09,LinkedIn (RapidAPI)
Principal Engineer Software - AI Data Pipeline,Palo Alto Networks,Santa Clara,,2025-05-15T19:15:28,LinkedIn (RapidAPI)
Data Engineer,Gradient AI,Boston,,2025-05-15T19:14:40,LinkedIn (RapidAPI)
Senior Data Engineer,Foundation Software,Strongsville,,2025-05-15T19:14:11,LinkedIn (RapidAPI)
Data Engineer,TieTalent,Zwolle,,2025-05-15T19:07:20,LinkedIn (RapidAPI)
ETL &#038; Data Quality Engineer (Informatica + Matillion) ,Highbrow LLC,Austin,,2025-05-15T19:05:36,LinkedIn (RapidAPI)
Senior Data / ML Engineer,Highbrow LLC,Atlanta,,2025-05-15T19:05:27,LinkedIn (RapidAPI)
Data Application Engineer,Tyler Technologies,Overland Park,,2025-05-15T19:03:21,LinkedIn (RapidAPI)
Senior Data Engineer,Mass General Brigham,Boston,,2025-05-15T18:59:30,LinkedIn (RapidAPI)
Engineering - Market Data Engineering - Software Engineer - Associate - Dallas,Goldman Sachs,Dallas,,2025-05-15T18:58:08,LinkedIn (RapidAPI)
AWS Data Engineer,Apex Systems,Houston,,2025-05-15T18:54:21,LinkedIn (RapidAPI)
Data Center Engineer,Apex Systems,Reston,,2025-05-15T18:54:21,LinkedIn (RapidAPI)
Machine Learning Data Engineer,Apex Systems,Fort Worth,,2025-05-15T18:54:21,LinkedIn (RapidAPI)
Staff Data Engineer,Tenstorrent,Santa Clara,,2025-05-15T18:48:22,LinkedIn (RapidAPI)
Lead Data Engineer,Ryan Specialty,Chicago,,2025-05-15T18:47:07,LinkedIn (RapidAPI)
Data Center Engineer,Insight Global,Memphis,,2025-05-15T18:45:51,LinkedIn (RapidAPI)
Data Engineer - Transformation Logistics,CVS Health,Austin,,2025-05-15T18:42:08,LinkedIn (RapidAPI)
Data Engineer,Elder Research,Arlington,,2025-05-15T18:38:35,LinkedIn (RapidAPI)
Data Engineer,Compunnel Inc.,Smithfield,,2025-05-15T18:38:04,LinkedIn (RapidAPI)
Data & BI Engineer (contract),Wells Fargo,Charlotte,,2025-05-15T18:36:42,LinkedIn (RapidAPI)
Azure Data Engineer,Recru,Sugar Land,,2025-05-15T18:32:57,LinkedIn (RapidAPI)
Medical Analytics Data Engineer,Pfizer,Tampa,,2025-05-15T18:30:19,LinkedIn (RapidAPI)
Medical Analytics Data Engineer,Pfizer,Cambridge,,2025-05-15T18:30:19,LinkedIn (RapidAPI)
Medical Analytics Data Engineer,Pfizer,Pennsylvania,,2025-05-15T18:30:19,LinkedIn (RapidAPI)
Medical Analytics Data Engineer,Pfizer,La Jolla,,2025-05-15T18:30:19,LinkedIn (RapidAPI)
Medical Analytics Data Engineer,Pfizer,New York,,2025-05-15T18:30:19,LinkedIn (RapidAPI)
Medical Analytics Data Engineer,Pfizer,New York,,2025-05-15T18:30:19,LinkedIn (RapidAPI)
Senior KDB Data Engineer,hackajob,New York,,2025-05-15T18:27:13,LinkedIn (RapidAPI)
Data Engineer - $150k+,Feldspar & Flint LLC,Austin,,2025-05-15T18:24:37,LinkedIn (RapidAPI)
Data Engineer,Wiraa,Texas,,2025-05-15T18:23:55,LinkedIn (RapidAPI)
Principal Engineer Software (Prisma Access Data-Plane Applications),Palo Alto Networks,Santa Clara,,2025-05-15T18:21:13,LinkedIn (RapidAPI)
Data Operations Engineer,Truist,Charlotte,,2025-05-15T18:20:51,LinkedIn (RapidAPI)
Data Operations Engineer,Truist,Raleigh,,2025-05-15T18:20:51,LinkedIn (RapidAPI)
Lead Data Systems Engineer,Truist,Raleigh,,2025-05-15T18:20:51,LinkedIn (RapidAPI)
Data Operations Engineer,Truist,Wilson,,2025-05-15T18:20:51,LinkedIn (RapidAPI)
Data Operations Engineer,Truist,Atlanta,,2025-05-15T18:20:51,LinkedIn (RapidAPI)
Data Operations Engineer,Truist,Richmond,,2025-05-15T18:20:51,LinkedIn (RapidAPI)
Data Center Facility Engineer,Allied OneSource,Kansas City,,2025-05-15T18:18:56,LinkedIn (RapidAPI)
Principal Engineer Software - AI Data Pipeline,Palo Alto Networks,Santa Clara,,2025-05-15T18:15:20,LinkedIn (RapidAPI)
Lead Data Engineer,Jobs via Dice,Eagan,,2025-05-15T18:11:01,LinkedIn (RapidAPI)
Data Engineer,Jobs via Dice,Washington,,2025-05-15T18:11:01,LinkedIn (RapidAPI)
Data Engineer,Jobs via Dice,Inver Grove Heights,,2025-05-15T18:11:01,LinkedIn (RapidAPI)
Data & ML Engineer,Jobs via Dice,Costa Mesa,,2025-05-15T18:11:00,LinkedIn (RapidAPI)
Data Engineer,Jobs via Dice,Atlanta,,2025-05-15T18:11:00,LinkedIn (RapidAPI)
Data Center Engineer,Jobs via Dice,Richardson,,2025-05-15T18:11:00,LinkedIn (RapidAPI)
Lead Data Engineer,Jobs via Dice,Eagan,,2025-05-15T18:11:00,LinkedIn (RapidAPI)
"AWS Data Engineer (onsite role - Seattle, WA)",Jobs via Dice,Seattle,,2025-05-15T18:10:59,LinkedIn (RapidAPI)
Azure Data Engineer,Jobs via Dice,Woodbridge,,2025-05-15T18:10:58,LinkedIn (RapidAPI)
Intermediate Snowflake Data Platform Engineer,Jobs via Dice,Dallas,,2025-05-15T18:10:57,LinkedIn (RapidAPI)
Jr Data Engineer (Life and Annuity),Jobs via Dice,Boston,,2025-05-15T18:10:57,LinkedIn (RapidAPI)
Data Engineer,Jobs via Dice,Seattle,,2025-05-15T18:10:55,LinkedIn (RapidAPI)
Snowflake Developer / Data Engineer,Jobs via Dice,New Providence,,2025-05-15T18:10:53,LinkedIn (RapidAPI)
Lead Data Engineer,Jobs via Dice,Jersey City,,2025-05-15T18:10:52,LinkedIn (RapidAPI)
Data Engineer (Local candidates only -Onsite),Jobs via Dice,Cincinnati,,2025-05-15T18:10:52,LinkedIn (RapidAPI)
Python Data Engineer,Jobs via Dice,Houston,,2025-05-15T18:10:51,LinkedIn (RapidAPI)
"Sr. Data Engineer (AWS, PySpark, Python)",Jobs via Dice,Centreville,,2025-05-15T18:10:50,LinkedIn (RapidAPI)
QA Engineer Data & API Testing W2/FTE Onsite only,Jobs via Dice,St Louis,,2025-05-15T18:10:50,LinkedIn (RapidAPI)
Data Engineer With Data Lake Services,Jobs via Dice,Vermont,,2025-05-15T18:10:50,LinkedIn (RapidAPI)
